{"pageProps":{"postsMetaData":[{"metadata":{"title":"The Core Lies In Modeling","description":"Comparison of computer algorithm competitions and university-level mathematical or simulation modeling competitions","imgName":"modeling-as-a-core/modeling-as-a-core.png","date":"Jul 1, 2025","tags":["model","algorithm","simulation"],"keywords":["algorithm","modeling","math"],"id":"modeling-as-a-core"},"content":"![The Core Lies In Modeling](modeling-as-a-core/modeling-as-a-core.png)\n \n###### Published on: **Jul 1, 2025**\n\nYes, the \"modeling\" in both computer algorithm competitions and university-level mathematical or simulation modeling competitions follows similar principles, though they differ in focus and application domains.\n\n### Key Similarities:\n1. **Problem Abstraction**:\n   - In both cases, the core lies in abstracting a real-world or problem scenario into a simplified **model**, which could be represented by variables, relationships, constraints, or rules.\n   \n2. **Use of Variables and Relationships**:\n   - In programming contests, you often define key variables (e.g., `dp[i][j]` for dynamic programming) to capture states.\n   - In university modeling contests, you similarly define variables (e.g., `x(t)` for time-dependent systems) and relationships (e.g., differential equations, statistical models).\n\n3. **Mathematical or Logical Formulation**:\n   - Both require translating the problem into a precise formulationâ€”be it an algorithmic model, a mathematical equation system, or a graph structure.\n\n4. **Computational Tools/Data Structures**:\n   - After building the model, appropriate data structures (like trees, graphs, arrays) or computational tools (like MATLAB, Python, or optimization libraries) are used to simulate, compute, or optimize the solution.\n\n### Differences:\n| Aspect | Algorithm Competitions | University Modeling Competitions |\n|--------|------------------------|----------------------------------|\n| Focus  | Efficiency, correctness, speed | Accuracy, realism, scalability |\n| Tools Used | Code (C++, Python, etc.) | Simulation tools, statistics, sometimes code |\n| Output | Program solving a specific task | Report + possibly simulation/model |\n| Timeframe | Short (hours) | Long (days or weeks) |\n\nIn summary, the process of **modeling** in both settings shares a common foundation: identifying the right abstractions and formalizing them to enable effective computation or analysis."}]},"__N_SSG":true}